date,review,rating,type,month
2020-10-20 03:28:21,"Ang hirap namn mg pa valid id sa inio halos passport na gamit ko,lage deny samantalang my gcash ako at paymaya,saglit mgpalevel yun din gamit ko id passport,kya 1 star lang rate ko sa inyo dami nyo hinihingi akala mo nmn mananakawan kayo tsk!!",1,play store,2020-10-01 00:00:00
2020-10-20 03:56:18,Coin.ph admin please response my concern its about 3days of trying to update this app. But until now update is not working..still update is waiting..its about 1year im using this app..but now why i encounter this problem..i follow som suggestion from here..i already try update my phone but still my coin .ph is not working Always on waiting for download...pls help.,1,play store,2020-10-01 00:00:00
2020-10-20 04:49:30,"What happened coins.ph??? Right now you are not consistent of the rebate you are giving???? Before, the rebate is 10% but lately you change it to 5% then go back to 10% in few days but yesterday you change the rebate again to 5%???? Before Ilike this app because of consistent 10%cashback in autoload but right now it's frustrating because there is no competition at all compared to GCASH and Paymaya!!!! I'll rate 1 star because of this!!!!",1,play store,2020-10-01 00:00:00
2020-10-20 08:46:59,This is a 1st time to get this app but I trying to download and used for any transaction if good or I don't know.. So I can see the latest news and information about this and other things I would be good for me and my plan was the first time I had to be a bit more about this,1,play store,2020-10-01 00:00:00
2020-10-20 09:04:34,daming kelangan para magregister cash out lang naman need ko huhuhuhu hirap talga pag estudyante kplang,1,play store,2020-10-01 00:00:00
2020-10-20 09:18:24,This app is not recommended for anyone ..it takes 3 weeks just to verify your personal information ..maybe you may choose other platform that can take hours only to verify.. unlike this.,1,play store,2020-10-01 00:00:00
2020-10-20 10:15:02,"Hinde na ako makapag log-in ,kahit updated naman yung application meron PA naman laman yung account sayang Lang yun hinde ulit mabubuksan",1,play store,2020-10-01 00:00:00
2020-10-20 11:21:00,Naga pa hina kong mag download elang bc konang na stop,1,play store,2020-10-01 00:00:00
2020-10-20 11:36:27,Please update load promos on Sun Network and Please improve the speed and stability of the app. It becomes slower and slower after updates. Slow loading even though I have a stable connection. Dont give me a bullsh*t reply just do it.,1,play store,2020-10-01 00:00:00
2020-10-20 16:07:53,Verification is a nightmare. I thought this app would be more convenient than Gcash but this is just another headache.,1,play store,2020-10-01 00:00:00
2020-10-20 16:23:08,"Cannot login via Google Authenticator. I entered the code correctly using my Google Authenticator with my linked email address. But whenever I entered the code, always displays, ""The verification code you entered is not correct. Please try again later."" Please help! I cannot login!",1,play store,2020-10-01 00:00:00
2020-10-20 23:31:30,hard to reload because limited establishment to transact..,1,play store,2020-10-01 00:00:00
2020-10-21 03:42:21,"Can't sign up and the verification code it's too long or no one can give verification code on my email, they give respond my email but there's no code to sign up. And i think they use my email address now im so disappointed this app 😠",1,play store,2020-10-01 00:00:00
2020-10-21 03:48:48,Been using this app since 2018 this week po naiba na yung balik saken ng load hindi na 10% bakit po bumaba pero nakalagay parin 10% cashback,1,play store,2020-10-01 00:00:00
2020-10-21 06:21:46,I bought load twice. The first one was unsuccessful but it was deducted to my coins wallet so I reported and tried another load which went successful. I even had a screenshot of those 2 transactions. The only reply I got from them is that they already successfully completed the 2 load transactions that I made even the first failed load which isn't and said amount was not even credited back to my coins wallet. They should've sent txt confirmation when they successfully completed the transaction.,1,play store,2020-10-01 00:00:00
2020-10-21 06:24:21,Don't download this app it's fake,1,play store,2020-10-01 00:00:00
2020-10-21 09:00:51,SUPER HASSLE NG APP NA TO 2017 to 2019 hindi nmn to ganito ngayong 2020 nag verify ka na u need to verify again via video call AND MAY SCHEDULE!!!! UNG PNAKA MASAKLAP PA DITO KUNG KELAN KAILANGAN UNG PERA DMO MAKUHA KUHA KC NAG VERIFY KNA SA APP NILA NUNG 2017 TPOS NGAUNG 2020 U NEED TO VERIFY AGAIN... HINDI NYO NA MAKUKUHA UNG PERA NYO SA APP NA TO... Kapag nagchat ka nmn sa suppot nila napaka tagal mag reply!!!!,1,play store,2020-10-01 00:00:00
2020-10-21 13:34:50,Poor apps. Always delay buy load. Then always maintenance. Don't down load this apps. There contact support is not responding immediately. Very poor services.,1,play store,2020-10-01 00:00:00
2020-10-21 14:45:00,"Worst bad rubbish app on Philippines : Guys don't try to use this app I'm done here coz its so annoying they eats money than balance ex. You have 2000 pesos on wallet you convert on btc in converting early they eat almost 300pesos plus then it's 1700 on btc I send on my coinb wallet it eats again 200 pesos plus so in all 600 pesos plus eat on you money but now is the worst ever coz I have only 750 pesos on wallet converts eth 640 left and send conbaise 390 left, they eat total 360 pesos 👹",1,play store,2020-10-01 00:00:00
2020-10-21 15:12:35,why i get 5% rebate instead of 10% in load,1,play store,2020-10-01 00:00:00
2020-10-21 16:21:59,"Im pissed off, I already sent more than 5x for selfie verification and yet it always says that it's not approved, like what kind of selfie do u want me to do, there's my face and me holding my I.D. this app is much more difficult to get verified than the other apps. Can you please fix your system. I will change my reviews once I get verified.",1,play store,2020-10-01 00:00:00
2020-10-22 00:00:51,after updating the ugly new version the small rebate on the load,1,play store,2020-10-01 00:00:00
2020-10-22 05:33:37,okey!,1,play store,2020-10-01 00:00:00
2020-10-22 06:23:26,I forgot my password. And when i press forgot password and lead me to another tab for reset it stops loading and just nothing happened. Now what???,1,play store,2020-10-01 00:00:00
2020-10-22 07:16:43,"Is it just me or the Email Verification for transferring takes too long, I keep sending the Email but not even 1 has showed up in my inbox, I logged out and I can't even log in cause these verifications take so long, fix this.",1,play store,2020-10-01 00:00:00
2020-10-22 07:35:56,"HORRIBLE, I WILL JUST DELETE YOUR APPLICATION BECAUSE ALL OF YOU ARE USELESS, I HAVE BEEN SUBMITTING AND FILLING UP THE FORMS OVER AND OVER FOR THE PAST YEARS AND STILL NO ACTION, ALREADY ESCALATED BUT STILL NO ACTION LETTING ME SUBMIT AND FILL UP USELESS FORMS THAT HAVE ALREADY BEEN FILLED UP, PLEASE DO NOT INSTALL THEIR APP I BEG YOU FOR YOUR OWN SAKE, IT IS A VERY USELESS AND STUPID APP WHICH IS A TIME WASTER AND THEIR INCOMPETENT EMPLOYEES TAKE DAYS TO PROCESS THE VERIFICATION, DO NOT USE.",1,play store,2020-10-01 00:00:00
2020-10-22 09:17:39,matagal mg cash out online.,1,play store,2020-10-01 00:00:00
2020-10-22 10:01:16,"loading too long, fee is very high...",1,play store,2020-10-01 00:00:00
2020-10-22 10:02:23,Worst cashless app in the universe...as in worst!!!,1,play store,2020-10-01 00:00:00
2020-10-22 10:32:32,still i can't update just loading so i can't open my account,1,play store,2020-10-01 00:00:00
2020-10-22 11:42:27,"I try to update my coins .ph, but i can' t open my account. and then i try to un install and its take too long to open again. still the same, nothing happens i can't download the app",1,play store,2020-10-01 00:00:00
2020-10-22 14:07:56,I waited my code since yesterday morning but two days now i didnt get my money yet. Why. So i cant get my money anymore????,1,play store,2020-10-01 00:00:00
2020-10-22 22:05:44,I was not able to receive my money from coinbase that i sent here in coin.ph but it shows in email that it was completed. What happend?,1,play store,2020-10-01 00:00:00
2020-10-23 01:45:46,Good day Coin ph .. Ask ko lang po kung Bakit nyo sinasabe na 10% rebate? Ang load Eh 5% lang naman binibigay nyo maging Honest po sana kayo wag kayo man luko ng tao chick nyo pong mabuti yong % ... Kung kilan malaki pinasok sa account saka nyo ginawang 5% * wag po sana kayo gumawa ng kwento na sinasabe nyo 10% kasi 5% lang pala nakita ko po sa history ng load yan lang bigay nyo hindi 10% wag nyo po sana kami gawing Tanga kaya nga po kami na engganyo sa Coin.ph dahil 10% ang rebate.,1,play store,2020-10-01 00:00:00
2020-10-23 09:00:33,Nice,1,play store,2020-10-01 00:00:00
2020-10-24 00:53:59,So far its good,1,play store,2020-10-01 00:00:00
2020-10-24 01:27:37,My account was deducted but I didn't received the cignal pin its been hours now seriously what happened to my money?,1,play store,2020-10-01 00:00:00
2020-10-24 01:49:59,I dont like it,1,play store,2020-10-01 00:00:00
2020-10-24 04:37:59,Not helpful! We need urgent transfer money but this app need a lot of verification 24 hrs 72hrs whatever this app so stressful!!!!,1,play store,2020-10-01 00:00:00
2020-10-24 05:46:50,Wala man lang transfer for gcash,1,play store,2020-10-01 00:00:00
2020-10-24 07:35:38,D makapagpalod ng mabilis,1,play store,2020-10-01 00:00:00
2020-10-24 10:44:43,I disappointed because i cant transfer money from gcash to coins..,1,play store,2020-10-01 00:00:00
2020-10-24 11:06:33,someone hack my account and send all my money to bitcoincash account..please help me how can i recover my money. akala ko mahigpit at coins at my otp pa panong my ibang nakalog.in sa account ko at ninakaw ang pera ko??,1,play store,2020-10-01 00:00:00
2020-10-24 11:19:20,Klase di makapag sign up..dami nyong dama..tragis,1,play store,2020-10-01 00:00:00
2020-10-24 14:29:32,"Not a friendly user application. It will ask you a trillion times for verification and you will still wait for a couple of days before they will verify your account. Also, when I add my passport details for additional verification it says that it's not approved?! How come?! All of the details I input was correct and cannot really understand this app. Do not use this!",1,play store,2020-10-01 00:00:00
2020-10-24 20:55:02,can't open the app because of the update but can't update,1,play store,2020-10-01 00:00:00
2020-10-24 23:04:20,Pahirapan sa verification! Kakaloka! pinapahirapan ung mga subscriber,1,play store,2020-10-01 00:00:00
2020-10-25 05:48:18,"Coins Pro are still available or not? Why I can't login in coinsPro using my account on coins.ph Because when trying to login there, the system's UI doesn't appear and system says it's a ""private beta and try visit on coins asia"", but when I trying click it I'm always back on the dashboard of my wallet through website.. thats why I'm little bit confused if that's the only me whose experiencing this?..",1,play store,2020-10-01 00:00:00
2020-10-25 13:54:38,"2:17pm_ P4 was automatically converted to ethereum and P2,003.88 automatically converted to bitcoin cash. Imagine, too automatic conversions at a time! I never thought such would happen. Maybe its a sure foolery.",1,play store,2020-10-01 00:00:00
2020-10-25 17:39:34,Can't install this app,1,play store,2020-10-01 00:00:00
2020-10-25 18:14:49,"Been using this for a long time but recently, the app seems to take forever to load even if I have good connection. Not very helpful especially if you need urgent access to your wallet. Hope you can consider making the loading time faster as there is no use for it if I can't access it.",1,play store,2020-10-01 00:00:00
2020-10-25 18:24:40,It should not take you days before you verify a phone number. Getting the code should already verify it. Address verification doesn't make sense too. The fact that i have submitted an id with my address on it should already verify my address. Your ways of verification is non sense. It makes consumers waste time before they can use the app. You can't even cash in without using the phone number you used to register with it. Fix your SYSTEM!,1,play store,2020-10-01 00:00:00
2020-10-26 03:08:46,"ayaw gumana, invalid yong sinesend nila na code",1,play store,2020-10-01 00:00:00
2020-10-26 04:21:21,Hayop na verification. Paulit-paulit.,1,play store,2020-10-01 00:00:00
2020-10-26 08:00:33,can i download this app to laptop?,1,play store,2020-10-01 00:00:00
2020-10-26 08:55:11,"ang bagal ng serbisyo nyo, mabilis pa pagong",1,play store,2020-10-01 00:00:00
2020-10-26 10:44:22,"When I get log in this app always want a code, but this app actually didn't send a code. Please fix this problem.... Also your gmail account didn't reply. Arghhh",1,play store,2020-10-01 00:00:00
2020-10-26 16:15:33,Too many security omg it my acct not user friendly,1,play store,2020-10-01 00:00:00
2020-10-26 17:02:40,So tagal mag verified 72hrs pa para lang sa mobile number.,1,play store,2020-10-01 00:00:00
2020-10-27 00:40:29,It is good at first but I could not verify my account. I have sent verification my IDs more than 3 times and still unverified. I already answered the source of income form whatsoever and still not verified. This is so frustrating.,1,play store,2020-10-01 00:00:00
2020-10-27 01:30:42,not user friendly. verification also takes a lot of time.,1,play store,2020-10-01 00:00:00
2020-10-28 03:11:39,My account is hacked and get all my money😭,1,play store,2020-10-01 00:00:00
2020-10-28 04:17:09,It gives me a hard time just to verify my account..i wait a couple of days but then after that it will ask again to scan my i.d and other details for verifying my account..pls fixed it..,1,play store,2020-10-01 00:00:00
2020-10-28 16:15:30,Bangladesh is a not allowing,1,play store,2020-10-01 00:00:00
2020-10-28 23:04:51,What happened to the app? It takes longer time to open and login.,1,play store,2020-10-01 00:00:00
2020-10-28 23:07:32,"since you update the app it became useless...the app is taking too long to load...you should fix this problem because many filipinos using this for buying load paying bills etc.it should be one tap app.sorry for the comment,but im just telling the truth.its frustrating specially if you need to access your wallet immediately but it stocks in intro page...verry disapointing..",1,play store,2020-10-01 00:00:00
2020-10-28 23:54:26,Bkit gnon Sabi nyo 10% cash rebates when I buy load eh bkit 5% lng bumabalik sa akin😠😠,1,play store,2020-10-01 00:00:00
2020-10-29 07:49:37,This is not a user friendly app unlike gcash,1,play store,2020-10-01 00:00:00
2020-10-29 08:08:03,I am not sure if I will use this app,1,play store,2020-10-01 00:00:00
2020-10-29 08:37:16,They finally have a lower currency for steam but the fee is too much. i liked it better when it didnt have a fee,1,play store,2020-10-01 00:00:00
2020-10-29 10:32:48,So difficult in verifying your ID.,1,play store,2020-10-01 00:00:00
2020-10-29 13:10:49,Napaka pangit ng service ng coins.ph ihohold nila account mo tpos hihingi ng kung ano ano.,1,play store,2020-10-01 00:00:00
2020-10-29 19:14:49,Why I can't sign in my account? I tried it 3 days but still not working.,1,play store,2020-10-01 00:00:00
2020-10-30 00:40:53,It's been a week since i last updated unfortunately it's the same each day. It's just keep on waiting to download. I can't even open the app cause it need to be updated.,1,play store,2020-10-01 00:00:00
2020-10-30 02:57:14,"I try to sign up and in nationality I can't find my country, i.e Pakistan. I am resident in Philippines. Its obvious that there is not all the nationally listed in the app.",1,play store,2020-10-01 00:00:00
2020-10-30 09:09:14,user verification takes weeks to verify,1,play store,2020-10-01 00:00:00
2020-10-30 12:03:18,"I can't use apps if not updated,I can't get my money on this apps,🦍💀💀",1,play store,2020-10-01 00:00:00
2020-10-30 12:21:07,"Cryptocurrency fee is too high. I converted Php 15,000 to btc when iy had a low value, only to get 14,300php worth of btc. What happened to my 700 pesos? Even if the BTC value increased, my money never returned to 15,000 again! Gosh, the fee for sending ETH is even higher than the ETH being sent. You need to fix this! This is basically daylight robbery!",1,play store,2020-10-01 00:00:00
2020-10-30 17:41:00,I really love this app😍😍 i use this since 2017 but now i notice its so hard to log in to my account it takes 5minutes long to wait before it appear the dashboard also i receive emails for changes load rewards thats make me sad😔🙁,1,play store,2020-10-01 00:00:00
2020-10-31 03:23:17,Slow loading takes almost 3 mins. to open the app. - Samsung S20 user.,1,play store,2020-10-01 00:00:00
2020-10-31 03:51:11,"I'm a student, why this app keep forcing me to find a ID that I never have",1,play store,2020-10-01 00:00:00
2020-10-31 05:21:14,Always concern for verification & I can't use this as expected in good & much easy way.,1,play store,2020-10-01 00:00:00
2020-10-31 08:34:41,Napakatagal ng verification nyo gagamitin nalang yon pera dipa macash out nakakainis Lang talaga puro verification kayo !!!!!!!,1,play store,2020-10-01 00:00:00
2020-10-31 12:59:22,Need to wait 24 hours for a reply! more than 30days and counting to resolve an issue. 😡,1,app store,2020-10-01 00:00:00
2020-10-31 17:45:01,No other ways of verification. Philhealth ID lang meron ako. Complete gov numbers ko. Hirap naman nito hindi maka cash out pag hindi verified yung account! Ayusin nyo naman. Is there any other ways to very my account please!,1,play store,2020-10-01 00:00:00
2020-10-31 22:14:58,I had a coins.ph account in the past and I honestly forgot about it. So I created a new one and it takes forever for me to be verified. Tired of waiting. There's a lot of way to make online payments and stuff and I rather use my banks app instead. Which are way more convenient. This shud be zero star. Disappointed.,1,play store,2020-10-01 00:00:00
2020-10-31 22:36:57,"This app is malware app. If you install this to your devise your battery will drain itself because install this app. Please to all Play Store user, here me out. Do not install this app. I already made my experiment. There is something in this app that we might not knos until now. This is dangerous both your device and personal data, because we are not sure if this app is safe. If you install this, uninstalling will no use, and you need to factory reset your device for your battery. Report to PS.",1,play store,2020-10-01 00:00:00
2020-10-31 22:51:09,There should always be an option to receive tge codes tgru email not only in mobile number. I've been requesting for codes a hundred times. Still I am not getting any codes.,1,play store,2020-10-01 00:00:00
2020-11-01 02:17:35,I tried this app and verify my identification but it always fail. I applied for verification for 5 times and i don't know if i'll still go for the 6th one.,1,play store,2020-11-01 00:00:00
2020-11-01 18:37:23,Why dont have bdo to online bank transfer?,1,play store,2020-11-01 00:00:00
2020-11-02 01:23:00,Actually haha i have lots of time to fix my account here til now but not yet fix pls help to fix it costumer service tnx,1,play store,2020-11-01 00:00:00
2020-11-02 03:37:56,"Why do I have to wait 3521, 3320, 3606,3604 seconds to create an account. Ghad fix this ASAP",1,play store,2020-11-01 00:00:00
2020-11-02 05:07:08,"The verification takes so long. Also won't let me upload my passport pic for additional information about my account no matter how many times I retry. The selfie thing is still ""under review"".. and it's been more that a month.. or even longer than that.",1,play store,2020-11-01 00:00:00
2020-11-02 06:59:36,I completely removed this app for almost 2-3 yrs now because of security issues. I no longer using it but i received notice of withdrawal/access.,1,play store,2020-11-01 00:00:00
2020-11-02 08:25:45,"Super loading. Can't buy load, always failed.",1,play store,2020-11-01 00:00:00
2020-11-02 11:07:51,Not sure if it was so good,1,play store,2020-11-01 00:00:00
2020-11-02 12:17:39,Why bitcoin fees is so insanely high 🥺,1,play store,2020-11-01 00:00:00
2020-11-03 05:55:43,"What is happening, I have already submitted all of my doucments for verification and it is taking ages to be verified. I need the money on my account",1,play store,2020-11-01 00:00:00
2020-11-03 07:30:23,Don't get fooled with this app. It will be a struggle for you to cash in and out remittances. Unless you send them a message and ticket that's the only time they will act on it. Decisive and very incompetent service.,1,play store,2020-11-01 00:00:00
2020-11-03 08:03:59,USING COINS IS VERY FRUSTRATING THESE DAYS. THE PBTC WALLET IN MY ACCOUNT WAS REMOVED. SO I NEED TO CONVERT MY PESO BALANCE TO BTC BALANCE. THE COINS.PH TEAM COULDN'T HELP ME WITH MY CONCERN.,1,play store,2020-11-01 00:00:00
2020-11-03 08:44:55,Pakistan not added y?,1,play store,2020-11-01 00:00:00
2020-11-03 12:48:53,"I cant open my old account, everytime I ""forgot password"" it does not send and email. I also cant re-register using the same ID, and I don't have any ID other than my driver's license, I hope it can be retrieved",1,play store,2020-11-01 00:00:00
2020-11-03 13:18:10,"Soo many verifications, even your sources of income? and indicating who is sending money to you? this is worse than CIA, even actual stock brokers & banks will never ask such a thing, Very diappointing.",1,play store,2020-11-01 00:00:00
2020-11-03 14:02:44,How to get my wallet address??,1,play store,2020-11-01 00:00:00
2020-11-04 03:45:21,What happen i cant recieve the code and also email .. Why automatic lou out.. And i cant change password because mo text message and also email,1,play store,2020-11-01 00:00:00
2020-11-04 06:39:07,"It's useless app, it's not really helpful. It took many days before they will give approval with your identification card. Someone sent me already remittance and untill now I am not able to claim it. It just give me a hassle to receive the my money remittance. I really fell so disappointed.",1,play store,2020-11-01 00:00:00
2020-11-04 07:20:38,When trying to load it prompts for a vwrification which is not required before. And verification email or sma does not arrive.,1,play store,2020-11-01 00:00:00
2020-11-04 11:28:21,Daming proseso bago mo magamit yung app. Kakawalang gana. Kinukuha nyo lng ata mga personal information ng mga user eh then after that wala pahirapan na sa proseso. Uninstall!,1,play store,2020-11-01 00:00:00
2020-11-04 13:01:07,"They hold my money and required an interview for me to regain my access to cash in and cash out. After interview, still they are requiring another documents.. will there be an end to this? Im so tired.",1,play store,2020-11-01 00:00:00
2020-11-04 15:33:42,Sakit sa ulo apps nato..verified na account q..bigla lang bumalik sa unverify..hirap pa nman e verify ulet.,1,play store,2020-11-01 00:00:00
2020-11-04 15:56:05,Waiting for verification is for ever. Poor management. I thought its better than g cash good thing did not load cash here hehehe bye app... deleted.,1,play store,2020-11-01 00:00:00
2020-11-04 19:17:20,Still no cash in at 7-11... Here 1 star 😏,1,app store,2020-11-01 00:00:00
2020-11-05 04:41:33,not friendly apps it makes verification difficult i try so many time and my my money cannot be cash out its really suck,1,play store,2020-11-01 00:00:00
2020-11-05 05:09:30,Çant.download the app,1,play store,2020-11-01 00:00:00
2020-11-05 05:32:17,"Why my cash in to my coins.ph from wester union is not working? I have the same name from the receipt and my coins.ph, , I asked our driver to send money and the receiver name is me, but still it's not working. MTCN is correct, same name on my coins.ph. Please help!!, I'm here in Saudi.",1,play store,2020-11-01 00:00:00
2020-11-05 07:19:23,Its useless many times to verify my account.... I complete the process then its can't verify my account ... Thats why i can't cash in...,1,play store,2020-11-01 00:00:00
2020-11-05 07:40:22,ANG BAGAL NG MGA CUSTOMER SUPPORT NINYO MAGHANDLE NG MGA PROBLEMS. SMS VERIFICATION LANG HINDI PA MAAYOS?!.,1,play store,2020-11-01 00:00:00
2020-11-05 13:47:50,Useless app,1,play store,2020-11-01 00:00:00
2020-11-06 02:33:33,cannot sign in ...coins.ph,1,play store,2020-11-01 00:00:00
2020-11-06 03:29:29,What happen I cannot cash out? Any Help please :(,1,play store,2020-11-01 00:00:00
2020-11-06 04:24:07,Very important,1,play store,2020-11-01 00:00:00
2020-11-06 05:12:16,Need an ID,1,play store,2020-11-01 00:00:00
2020-11-06 10:31:44,i give one because ayaw nila tanggapin ang valid id kong ito my police certifecate sabi nila pwde anu bang nangyari sa coinsph pinahihirapan nila yung gusto magkarun ng coins ph wallet para din sana makapagcash in ka agad... pls naman coins ph tanggapin ninyo ang virification ko wala na kasi akong ibang valid id na makukuha dahil pandemic ngayon....,1,play store,2020-11-01 00:00:00
2020-11-06 23:45:19,Worst app.,1,play store,2020-11-01 00:00:00
2020-11-07 14:52:42,So many verification after i gave my id it want to know my source of income and they just keep digging deeper. Do you want my birth certificate too? My daily day i do? I keep my privacy. Ill stick to gcash their verification is easier and they alreasy verified my acc thru id and other thing,1,play store,2020-11-01 00:00:00
2020-11-08 04:31:04,After the update. It is stuck in the loading page.,1,play store,2020-11-01 00:00:00
2020-11-08 11:04:43,I'm not getting the code. Do not install this app. When I installed this app it was so ugly,1,play store,2020-11-01 00:00:00
2020-11-08 11:06:08,Noting i can't download,1,play store,2020-11-01 00:00:00
