date,review,rating,type,month
2021-02-20 10:28:01,So yun nga. Before ko dinownload to nag tingin tingin ako sa 1star review na kesyo matagal mag approved or ma verify Yung Id. So sa una sinadya Kong maliin Yung id info and other info.(etc) then under 1 day lang na na detect agad na not valid Yung id and Yung mga ibang info. Then nag try na ako ng real id na request nila na dapat ibigay (postal Id lang) then hanggang ngayon di nila ma verify mag iisang buwan na Wala parin. Di rin nag notice na not valid. Ayus ayusin nyo naman.,1,play store,2021-02-01 00:00:00
2021-02-20 12:00:01,Poor service said Verify 1day but it's over 1 day but still under review are you serious????,1,play store,2021-02-01 00:00:00
2021-02-20 13:26:06,Please check this app is going away with people's hard earned money. I was logged out of the app and I couldn't logged in any more I changed password still thesame please do something please 😓😓😓😓,1,play store,2021-02-01 00:00:00
2021-02-20 20:06:02,"the worst apps, tolerated scammer to excel, i sent already my problem and yet, you did not solve even i aleady sent the proof,",1,play store,2021-02-01 00:00:00
2021-02-21 00:28:23,"I've been using this app for almost 1year but few days ago i had bad experience, my account suddenly deactivated while sending BTC and the amount was loss.",1,play store,2021-02-01 00:00:00
2021-02-21 07:20:07,anung petsa na phone number palang na verified nyo,1,play store,2021-02-01 00:00:00
2021-02-21 09:17:15,Don't try this app because of high fee,1,play store,2021-02-01 00:00:00
2021-02-21 09:35:59,"Its good for load but for cryptocurrencies, much better Binance lowest rate fee than this cmon 5% lols.",1,play store,2021-02-01 00:00:00
2021-02-21 10:09:13,Its hard to verify my account pls. Help me....,1,play store,2021-02-01 00:00:00
2021-02-21 10:53:49,"Hi coins ph devs, can i know when will i get my payment for bitcoin, i still havent receive it yet it’s been 5 days or so, last time the process is fast but now it’s so slow what happned?",1,app store,2021-02-01 00:00:00
2021-02-21 16:25:42,i cant open the app,1,play store,2021-02-01 00:00:00
2021-02-21 23:38:50,The app does not let you cash in money to start and it keeps asking to verify the phone number even though i have already verified it a couple of time. To the developer of this app i need your help to straighten this. Thank you,1,play store,2021-02-01 00:00:00
2021-02-22 00:35:04,Lol... can't open coinspro..,1,play store,2021-02-01 00:00:00
2021-02-22 03:04:57,after an update when im about to use my app i found my self logged out..now icant log in back. itry to do the forgot password but after few minutes still dont get a reply for a code.,1,play store,2021-02-01 00:00:00
2021-02-22 03:11:32,Bwesit eh hina magbigay nag code kahit mag sign up pa. Nakakainis.!!!,1,play store,2021-02-01 00:00:00
2021-02-22 03:49:59,I cant create my eth wallet.Can you pls do something about it,1,play store,2021-02-01 00:00:00
2021-02-22 05:32:47,the most paranoid app in the history of mankind,1,play store,2021-02-01 00:00:00
2021-02-22 06:59:15,I don't like this app because he use to login out person and is so very hard to login in so this app is not good,1,play store,2021-02-01 00:00:00
2021-02-22 07:36:03,Fix the identity verification it says failed to upload 1 year to register this app😠,1,play store,2021-02-01 00:00:00
2021-02-22 07:38:03,I could not even install this on my Samsung Note 20 Ultra with Android 11 and One Ui 3. Same with the Note 10 Plus with Android 10 and One Ui 2.5. Already reported it but no reply. IOS version works. How did you guys get this to install?,1,play store,2021-02-01 00:00:00
2021-02-22 13:27:27,"Pansin ko lang everytime na bumababa ang cryptocurrencies, nagccrash o hindi magamit ang crypto features nila. Tulad ngayon na bumaba ang ethereum, naging unavailable ang wallet nito",1,app store,2021-02-01 00:00:00
2021-02-22 14:25:53,if theres a 0 star i will rate it 0 Worst Customer service ever!! Thankyou for.being no help at all ! will not recommend this kind of app,1,play store,2021-02-01 00:00:00
2021-02-22 15:01:53,It took so long to verified your account. Almost 1 week but since I update the requirements needed but it doesn't approved by this plataforms,1,play store,2021-02-01 00:00:00
2021-02-22 20:04:43,Ang hirap mag upgrade ng account.. nakailang picture nako tama naman yung pinasok kong picture but still it direct me to upload photo loop Worst app,1,play store,2021-02-01 00:00:00
2021-02-22 22:06:46,You said verification within 24 hrs? It's been 48 hrs and still no verification. What kind of service is this? You want us to cash in but not cash out?,1,play store,2021-02-01 00:00:00
2021-02-22 22:19:40,Jusko antagal nyo magverify ng account. 1week na. Di parin verifed yung akin. Ano na?,1,play store,2021-02-01 00:00:00
2021-02-23 03:20:48,Why this app doesn't accept students id this app sucks Please accept student id,1,play store,2021-02-01 00:00:00
2021-02-23 03:25:39,i can't verify my number... oppo 2f what should i do??,1,play store,2021-02-01 00:00:00
2021-02-23 04:52:07,Power of choice,1,play store,2021-02-01 00:00:00
2021-02-23 05:24:18,"It has been more than 48 hours since I verified my id, still nothing :).",1,play store,2021-02-01 00:00:00
2021-02-23 05:34:07,"Hi there coins.ph devs, i am so disappointed in you guys, here's the thing, I haven't receive my bitcoin payment yet, after a 5 days or so there's nothing yet on my account why is that? It only days waiting for cofirmations, why is that you haven't confirmed my payment yet? Arrrg",1,play store,2021-02-01 00:00:00
2021-02-23 07:29:30,Cant withraw my funds. They put it on hold for 30 days and more for no reason. Please never use this if you wanna trade with cryptos. These people are a bunch of scammers!,1,play store,2021-02-01 00:00:00
2021-02-23 07:38:27,why is it taking so long to verify coins.ph for 3 days now there is still nothing ￼,1,play store,2021-02-01 00:00:00
2021-02-23 08:11:28,Trying to reset my password but God why it is so hard? Your verification was late and it doesn't work. Please fix this cos it doesn't worth my time.,1,play store,2021-02-01 00:00:00
2021-02-23 08:22:37,I got loan from tala and i use my coin. Ph app as ewallet but unfortunately i cant cash out because it restarted to registration and until now i cant get my money!!!,1,play store,2021-02-01 00:00:00
2021-02-23 08:46:23,It takes so long to verify.i couldnt cash out my money!,1,play store,2021-02-01 00:00:00
2021-02-23 10:02:11,Good app but worst in verification takes 15 days to verified now 5 days and counting which makes 20 days just only for this and thanks for limiting my account because its indefinite the woooorst,1,play store,2021-02-01 00:00:00
2021-02-23 10:16:18,"The price from coins and the actual crypto price has big gaps, expensice fees.",1,play store,2021-02-01 00:00:00
2021-02-23 10:46:13,"Coins.ph is a good app, the 10% cashback is what I love the most but for the past months I've been trying to get verified to atleast level 2 that way I can transfer money and cash in using my bank but the app keep saying that its not approved. It's so sad that I even processed my NBI just to get verify. The app even say that their team will processed it within 24hrs, but it takes more than a week, and sadly I wait for nothing. So frustrating.",1,play store,2021-02-01 00:00:00
2021-02-23 10:57:25,"Super hindi accurate trading nyo, halatang ginagatasan nyo mga tao, wala bang rate na mas mababa sa 1? Napaka walang kwenta nyo",1,play store,2021-02-01 00:00:00
2021-02-23 12:59:54,I did not receive the verification code even though I selected the correct country and typed my correct number,1,play store,2021-02-01 00:00:00
2021-02-23 16:23:28,Whats wrong with this app. I can't pass the verification .. I had drivers license ang UMID id and etc.. But they wont accept it.. I want to do more with this app but how could i do my things if you guys wont let me pass your verification... 1 star for now,1,play store,2021-02-01 00:00:00
2021-02-24 01:08:47,Kelan kaya nyo ibabalik si SSS Contributions? 2years na po naka under maintenance 😢😢😢,1,play store,2021-02-01 00:00:00
2021-02-24 01:36:55,can't create eth wallet. what good is this app for?,1,play store,2021-02-01 00:00:00
2021-02-24 02:29:43,Almost a week and still not verified. It says 1 business day only.,1,app store,2021-02-01 00:00:00
2021-02-24 05:24:42,"So discouraging, I provided all the documents they are asking but I can't get to level 3. I don't recommend using this app. There are better app out there that you can use.",1,play store,2021-02-01 00:00:00
2021-02-24 05:59:33,"I rate it 1 star because I tried so many times to verify my account but I can't.. I really want to make my account fully verified so that I can link it to my other accounts but I just can't.. I use my police clearance ,my NBI clearance and my police card but coinsph always says it failed to submit....I hope you notice my review so that I would know what I'm going to do with it.",1,play store,2021-02-01 00:00:00
2021-02-24 07:13:33,I called your hotline many times. It's ringing but no one is answering the call . The document submitted is BIR 2316 nkapagay naman SA taas 2019 .. yearly po aNg 2316 WHY are you asking about issued date... I will report this to government esp. banko central .. I think this app is bogus..,1,play store,2021-02-01 00:00:00
2021-02-24 08:18:02,"tulungan nyo naman po ako makuha yung pera ko sa coins, laging under review wala namn nangyayari, inutang ko pa naman yun sa TALA, pagkatapos nakatanggong lang sa coins, kailangan na kailangan ko yung pera tapos laging under review, ano po ba nagrereview ba talaga? 1 day na ang nakalipas Ma'am /Sir, hanggang ngayun wala pa rin.",1,play store,2021-02-01 00:00:00
2021-02-24 08:23:15,Nice,1,play store,2021-02-01 00:00:00
2021-02-24 09:02:25,I Don't think you deserve a one star I am waiting for my verification for almost a week !FOR ALMOST 7 DAYS !,1,play store,2021-02-01 00:00:00
2021-02-24 11:25:29,"Not Support Coin Thailand User !!! , Why show download banner this app in coin.co.th ???",1,play store,2021-02-01 00:00:00
2021-02-24 16:22:57,"I am in much disappointed with the services because of so much slow and delayed it offers and the verification of the account took more than a week to verified... Until now there are still one part that haven't been verified yet.. I thought it was so fast since I am in a hurry to use it, but until now I can't use it and been delayed for more than a week... I hope the services and verification can be done immediately",1,play store,2021-02-01 00:00:00
2021-02-24 23:09:10,Transaction fees are high... Worst,1,play store,2021-02-01 00:00:00
2021-02-25 00:24:53,App error even the website,1,play store,2021-02-01 00:00:00
2021-02-25 00:48:26,"Your verification process made me rate this apps a lowest. It tooks so much time to be verified. You can't send/transfer funds while your verification is still in process. While they are allowing you to add funds. What is the purpose of adding funds when you cannot use it to transfer to your family? They shouldn""t allow you to fund your account while under verification to make it fair to their customer. I never thought of this kind of process. I regretted so much by using tbis apps.",1,play store,2021-02-01 00:00:00
2021-02-25 01:53:39,PAKYU SA INYO DI NA APPROVE YUNG ID DAHIL DI DAW CLEARED ANG SIGNATURE PANO MA CLEARED YUN EH YUNG PAH PRINT NG I.D DI NA CLEARED KING INA!,1,play store,2021-02-01 00:00:00
2021-02-25 02:19:44,3weeks using this app and still declining my verification. Its was so cleae and all the letters are readable and still declined? Worst app,1,play store,2021-02-01 00:00:00
2021-02-25 03:25:43,☹️,1,play store,2021-02-01 00:00:00
2021-02-25 06:12:09,"Not a good app,my fund isn't work. Only on good comments are replied",1,play store,2021-02-01 00:00:00
2021-02-25 07:14:14,I convert my BTC but I did not recieved the amount! Please help,1,app store,2021-02-01 00:00:00
2021-02-25 07:24:20,Sucks. Sending a code always takes eternity.,1,play store,2021-02-01 00:00:00
2021-02-25 07:39:58,"Its took years to verify your account, and am still waiting for it😕😕😡😠",1,play store,2021-02-01 00:00:00
2021-02-25 08:12:29,I can't open the dashboard...it's frustrating! Please fix it,1,play store,2021-02-01 00:00:00
2021-02-25 08:20:19,The Verification to encash is too long. It will take one week or more. I don't know. It's my 5 days now. And still on review. I couldn't cash out. It cause a lot of trouble especialy on my case. I have an emergency. I need a fund. But i couldn't cash it out because of that one week verification.,1,play store,2021-02-01 00:00:00
2021-02-25 08:42:05,punyetang apps walang naitutulong.. ang daming hanash simula lng nag update di ko na ma access account ko.. sinabi ko wlang yung phone na andun yun number ko wala na tlga.. kainin niyo apps isaksak niyo sa baga mga peste!!!,1,play store,2021-02-01 00:00:00
2021-02-25 09:10:51,Does not send SMS verification which is required if you plan to pay bills,1,play store,2021-02-01 00:00:00
2021-02-25 09:42:35,"The cs is involved in fraud, its the only explanation. They pretend they can't read and then they request additional documents to sell on the black market. After I told them I'm alright and won't be giving any more documents that is not following company policies, they tampered with my cash in limit and kept trying for more documents outside of coins ph policies! Criminals. I reported them to pnp cybercrime.",1,play store,2021-02-01 00:00:00
2021-02-25 14:53:28,hi please make action i send an email. the remmitance didnt reflect in my account. from Western union,1,play store,2021-02-01 00:00:00
2021-02-25 15:23:09,"this is upsetting, I can't pass the verification of my ID for the 2nd time even though it was cropped and clear for checking, it's supposed to be processed in 1 buisness day but I have to wait 3 days, I can't cash out and it's frustrating.",1,play store,2021-02-01 00:00:00
2021-02-25 18:54:48,Bakit di ako makapag cash in,1,play store,2021-02-01 00:00:00
2021-02-25 21:28:09,Always http error when I send crypto currency using blockchain address and so slow action disappointed my transaction was cancelled for this issue everytime,1,play store,2021-02-01 00:00:00
2021-02-25 21:33:46,I recommend Gcash and Binance not this app.,1,play store,2021-02-01 00:00:00
2021-02-26 01:00:10,Not accepting documents,1,play store,2021-02-01 00:00:00
2021-02-26 06:14:58,Ang hirap ng ma veryfy mga id's. Pwede naman philhealth ngayun kasi may birthdate naman ah,1,play store,2021-02-01 00:00:00
2021-02-26 06:31:48,Could improve the delays in transferring money,1,app store,2021-02-01 00:00:00
2021-02-26 08:04:04,"This is my first time to download this app. It is hard to fill out the personal info including to upload your valid id's i hate it, how many times i repeat to upload my umid id but its always failed to upload i dunno the reason why ,so wasting time.😣until now my account is not yet verified after two days they thought just for 24hrs but what happend?",1,play store,2021-02-01 00:00:00
2021-02-26 10:03:50,Nkaka asar ang hirap ng process pag pasa ng mga documents kpag naabot mo na ung limit. Ang sabi 250k ang montly limit eh wala pa nga ako sa kalahati nakahold parin ung pondo ko. Irerelease ninyo kpg wala ng value ung mga crypto na inimbak senyo.. 30times nko nagpasa at nag upload ng mga requirements nio ..wala pang customer service ...😱,1,play store,2021-02-01 00:00:00
2021-02-26 10:36:33,"Admin, pls notice my concern. Blurry SELFIE I think the problem of my account is the selfie. Because the phone that I used to create my account had a broken front camera. Thats why when my first attempt to verify my account, Im sure that my selfie is blurry with broken camera FIRST ATTEMPT: rejected (my school I.D) SECOND ATTEMPT: rejected (police clearance) it said that my id is blurry. But I think the opposite. Im sure my selfie is blurry not my police clearance.",1,play store,2021-02-01 00:00:00
2021-02-26 10:53:05,mag gcash nlng kayo wag eto...ang dami neto alam account verification aabutin ng 3 days pwe..anu tingin nyo sa sarili nyo bangko. gcash bilis ng verification..bulok,1,play store,2021-02-01 00:00:00
2021-02-26 11:00:57,grabe sobrang pangit serbisyo nyo!!palagi nkng wrong code pag enenter ko yong verification code na pinasa nyo..paano ako makapagtransfer fund neto kung palagi nlng sinasabing wring code pag inenter ko yong code na sinend nyo?,1,play store,2021-02-01 00:00:00
2021-02-26 12:32:50,crappy system! 1 business day dw ung verification pro mag iisang buwan n pblik2x hingi ng selfie verification,1,play store,2021-02-01 00:00:00
2021-02-26 12:45:09,Why it always say that it cannot recognize the qr code?,1,play store,2021-02-01 00:00:00
2021-02-26 13:02:52,Potangina mo maryong user na ginamit phone ko tapos ibang gmail naka lagay tangina nyu! Ngayon di ako maka change gmail,1,play store,2021-02-01 00:00:00
2021-02-26 15:04:01,Ang hirap mag verify grabi naka ilang try na ako wala parin unlike gcash ilang days lang verify na ano ba klasing admin to,1,play store,2021-02-01 00:00:00
2021-02-26 15:22:03,Its hard to verify your account i tried 10 times still not verify stupid dev,1,play store,2021-02-01 00:00:00
2021-02-26 16:08:58,Its takes a long time before you get verified. How many times do i have to upload my IDs and get rejected??,1,play store,2021-02-01 00:00:00
2021-02-26 16:09:21,"BEWARE, This is the ONLY APP that COLLECTS a LOT of PERSONAL INFORMATION from their USERS. Be careful of sending too much information with this app. Also, if they notice a sudden change from your transactions, they will require you for an interview which they will COLLECT more INFO about you. They will freeze your acct if you will not comply. If you don't want any HASSLE, I advise to use direct apps like GCASH or SMART App original BANK Apps or another CRYPTO currency Apps, much more reliable.",1,play store,2021-02-01 00:00:00
2021-02-26 16:16:18,"I have been submitting my verification for review. I Submittes my PRC ID and other requirements needed for verification in order to cash in. But it is always rejected.  Please fix this!

Parang t@nga naman yung nagveverify ng ID ko. 2 months ko na inapply ayaw pa din i approve ampo+@. Bahala kayo!!!",1,app store,2021-02-01 00:00:00
2021-02-27 04:46:12,"Im so disappointed of verifying ID's , i cant upload my Liscense ID , i did many times trying to upload it to verify but it says failed to upload ,always, Hope you fix this issue, hard to verify , even my ID is new For now i didnt give 5 stars until not fix",1,play store,2021-02-01 00:00:00
2021-02-27 07:46:06,The app doesn't want to open! And I'm using an Android 9.,1,play store,2021-02-01 00:00:00
2021-02-28 00:27:29,This is legit but when will you fix etherium coin??? I think it will be okay if the trade goes up again🤔🤔🤔,1,play store,2021-02-01 00:00:00
2021-02-28 02:29:48,"Cannot undo selfie verification. My selfie verification is already under review for 5 months and I tried asking for help and someone replied but she/he did not answer my question or my request in undoing the selfie verification. I understand that it will take a bit long but really 5 months? Come on. Already reported in the app, gmail, and now here. Hopefully this time coins.ph will notice this.",1,play store,2021-02-01 00:00:00
2021-02-28 03:30:26,It's really hard to get verified in this app guys I tried many times and it went failed again and again.. please fix this and I hope they update it with the student ID verification..,1,play store,2021-02-01 00:00:00
2021-02-28 04:19:46,Pls verify My account pls and I will give 5 🌟 star pls,1,play store,2021-02-01 00:00:00
2021-02-28 07:04:49,I have some queries yet they are always closing the conversation without addressing my questions. I cannot trust it.,1,app store,2021-02-01 00:00:00
2021-02-28 11:42:30,It is hard to use,1,play store,2021-02-01 00:00:00
2021-02-28 12:24:41,Taas ng charge baba pa ng value sa mga crypto👎,1,play store,2021-02-01 00:00:00
2021-02-28 13:30:54,When you buy BTC is verry high price but when you sell it verry lowest price over charge fee to exchange 😤👎,1,app store,2021-02-01 00:00:00
2021-02-28 22:48:04,"May I know until now di parin na approve ang verification process ko??? Knowing drivers license, at utility bills napo. Kakainis neep po kasi mag cash out kaso di ma approve2 yung verfidication ko. BAKA SCAM PO ITO!!",1,play store,2021-02-01 00:00:00
2021-03-01 01:58:59,When are you going to fix the eth wallet?? It take so long! The eth price now is low and I can’t buy any eth!!!!,1,app store,2021-03-01 00:00:00
2021-03-01 04:24:07,Lumalabo camera kapag app yung gamit kaya ang hirap magpaverify. Update niyo naman po app niyo para convenient gamitin.,1,play store,2021-03-01 00:00:00
2021-03-01 04:28:34,I can't create an account here.,1,play store,2021-03-01 00:00:00
2021-03-01 04:40:15,Its way too difficult to verified.,1,play store,2021-03-01 00:00:00
2021-03-01 06:28:17,"I inserted money in coins.ph from my coinbase acct. And it doesn't appear in my coins.ph acct. Coinbase just told me, that my money was already transferred! Please fix!",1,play store,2021-03-01 00:00:00
2021-03-01 11:52:48,ID and selfie verification process takes too long. They said it would be done in 1working day. It's been 5days but until now it's still under review.,1,play store,2021-03-01 00:00:00
2021-03-01 16:30:59,DONT USE THIS APPS SCAMMER THEY TAKE YOUR MONEY NOT RECOMMENDED POOR SERVICE SLOW CUSTOMER SERVICE SLOW APPROVED VERIFICATION MUK MAFI,1,play store,2021-03-01 00:00:00
2021-03-01 17:10:27,I haven't yet verified. I already sent my valid ids and other requirements. Please review them again. I cannot use my wallet. Thank you,1,play store,2021-03-01 00:00:00
2021-03-01 17:36:11,When will Ethereum wallet creation be functional again Po?,1,play store,2021-03-01 00:00:00
2021-03-01 18:17:32,This current version of coins. Ph are worst. They put fees on sending money to any bank accounts or any e wallet. Coins.ph are getting worst!!!,1,play store,2021-03-01 00:00:00
2021-03-01 23:42:08,Beta,1,play store,2021-03-01 00:00:00
2021-03-02 00:01:18,Converting Crypto to Cash reduces Cash In Allowance. What a joke.,1,play store,2021-03-01 00:00:00
2021-03-02 02:30:05,"Help center without help, doesn't make any sense.",1,play store,2021-03-01 00:00:00
2021-03-02 06:48:06,Fee to much high,1,play store,2021-03-01 00:00:00
2021-03-02 07:03:49,I send my requirements many times to verified my acc. But you always reject . Poor verification process. It's says 24 hours to review then you have to wait 3days and then they reject your files.,1,play store,2021-03-01 00:00:00
2021-03-02 08:40:15,"V E R Y P O O R VERIFICATION PROCESS! IM SO DISAPPOINTED TO DOWNLOAD THIS APP...SUCH A WASTE OF TIME...1 BUSSINESS DAY ON VERIFICATION PROCESS?!...SERIOUSLY?,MAYBE 1 YEAR... I SUGGEST NOT TO TRY BEC YOUR MONEY WILL BE WORTHLESS UNTIL YOU HAVEN'T PASS ON LEVEL TWO!!!",1,play store,2021-03-01 00:00:00
2021-03-02 08:48:11,"Takes too long to review documents, changing mobile number and too slow response on the help center. I don't recommend this app if you have too many transactions to make.I already emailing 2 Customer Representatives but still, it takes too long. Are they all sleeping?",1,play store,2021-03-01 00:00:00
2021-03-02 11:24:24,"When I open the app earlier my account got logged out and when i'm trying to sign in my account, nothing is happening so I tried changing the password but it says no payload received. Please help!",1,play store,2021-03-01 00:00:00
2021-03-02 12:23:09,Too long(takes whole day) to transfer money to bank or another e wallet service. Please fix this.,1,play store,2021-03-01 00:00:00
2021-03-02 14:23:38,"Too much charge for a BTC conversion. Imagine transferring 1500 php to a broker then getting 5USD (around 250php) in return? This is absurd. They charge too much, then a very slow transaction, about more than the average 10minutes. Very disappointed.",1,play store,2021-03-01 00:00:00
2021-03-02 14:55:52,i cannot sign up tp your coins. ph whats wrong? your apps experiencing error i cannot go in to the features inside the app,1,play store,2021-03-01 00:00:00
2021-03-02 17:12:29,So unreliable!!! Grr!!!,1,play store,2021-03-01 00:00:00
2021-03-02 19:06:45,"My wallet just logged out then I can't log in. It says that my email/phone number and my password does not in file. So i tried to change my password. Sent a verification code to my email for many times but I didn't recieve any code then I tried to use my phone number, still no verification code. So what is this? Are you a scam or what? This is my first time to rate an app because I am so disatisfied and disappointed!",1,play store,2021-03-01 00:00:00
2021-03-02 20:51:04,When will be ETH wallet available to create?,1,play store,2021-03-01 00:00:00
2021-03-02 22:46:51,Transferring bitcoin to another bitcoin account ( transferring fee will exceed you expectation more often bigger than the money 💸💰💸 you'll transfer),1,play store,2021-03-01 00:00:00
2021-03-03 00:38:00,Thief apps bitcoins rates is not accurate literal scam i checking btc price online they not same example real btc price is 2300000 but in coins.ph shows 2200000 see big thief,1,play store,2021-03-01 00:00:00
2021-03-03 01:19:41,TAKES SO MUCH TIME TO GET VERIFIED,1,play store,2021-03-01 00:00:00
