date,review,rating,type,month
2020-06-01 14:08:25,How to cash in to 7/11?? Coins.ph,1,play store,2020-06-01 00:00:00
2020-06-01 22:34:43,This is a useless app i can't even put my phone number i can't even copy my btc address and the worst o,1,play store,2020-06-01 00:00:00
2020-06-01 23:01:23,I've been trying to register to this App and I can't receive any of the Verification codes. I tried both E-mail and phone number registration,1,play store,2020-06-01 00:00:00
2020-06-02 01:57:56,Ilang besis ako nagsend ng id.. Not succesful. Di ko alam kung anong id ang gusto. Di ko tuloy magamit,1,play store,2020-06-01 00:00:00
2020-06-02 03:20:49,It's says 1 day to process! This is 3rd day waiting just for my phone verification!! Stil says in progress.... U want to have Headache? Install this app,1,play store,2020-06-01 00:00:00
2020-06-02 05:13:03,"bkt gnun tgal kona gamit c coin.ph tapos ngaun mag lologin ako ayw na sabi lng sorry, this service cannot supported in NY region.ano po ibg sabihn nya? nsa pilipinas lng po ako.please help me.if you fixe this i give u 5 stars.",1,play store,2020-06-01 00:00:00
2020-06-02 05:19:01,Does not even process my acc.,1,play store,2020-06-01 00:00:00
2020-06-02 08:00:39,I keep on logging in to this acount every time i open my account i always start with changing of my password then verification .my app was installed allready on my phone why suddenly it says the apps was log out for security reason. Thats make me head ache everytime i openy account. There is a sign of ? On my wallet. Please i want to restore back my coin wallet app on my wall using PIN to open it. Thanks,1,play store,2020-06-01 00:00:00
2020-06-02 09:48:39,So Stressful.. Cant do cash-in.. Already have verification to pay at dragonpay but always appear the apps via google.. Cant proceed to dragonpay payment 👎👎👎,1,play store,2020-06-01 00:00:00
2020-06-02 10:14:28,i can't even register i dont receive any confirmation code or activation code wth this app if you want to ruin your mood download this coins.ph haha,1,play store,2020-06-01 00:00:00
2020-06-02 11:06:37,I just updated my coins app and guess what. It never opened again. I tried to install and uninstall but still the same problem occurs. Its not opening any information about me. I even made a cash before this happened! I already sent you an email!,1,play store,2020-06-01 00:00:00
2020-06-02 16:02:17,If only I can give you negative star I will definitely do that. I can't create my own account due to the SMS verification code it takes forever to receive it. Fix your services if you want customer's or good rating. I'm sorry but your performance frustrates me.,1,play store,2020-06-01 00:00:00
2020-06-02 16:11:27,"No SMS sent, No verification sent to my email. Waste of time",1,play store,2020-06-01 00:00:00
2020-06-02 18:17:41,There's no verification code that was sent to my email address everytime I click so I can't verify my email address and my passport also wasn't able to upload that's why I can't upgrade my coins wallet account to level 2.,1,play store,2020-06-01 00:00:00
2020-06-02 21:38:16,Mahirap minsan mglod,1,play store,2020-06-01 00:00:00
2020-06-03 04:52:23,"Ni nakaw ang €56 ko.. Na. Tna transfer ko, pa punta dito sa coins.ph na to! Hoy coin.ph ayusin nyo yan..ng gagago kayo..",1,play store,2020-06-01 00:00:00
2020-06-03 05:43:48,Di aq maka log in taena nyo mga animal kau dami beses q n resit password q Wala pdin,1,play store,2020-06-01 00:00:00
2020-06-03 06:35:28,eww,1,play store,2020-06-01 00:00:00
2020-06-03 08:52:12,I can't install your app what the hell,1,play store,2020-06-01 00:00:00
2020-06-03 09:05:36,I cant access,1,play store,2020-06-01 00:00:00
2020-06-04 00:35:36,"Everytime I open the app, i always have to log in...and it shows that ""service id not supported in NY""... i dont understand what it means.... im disappointed 😭😭😭",1,play store,2020-06-01 00:00:00
2020-06-04 01:19:44,"I wasn't informed that 7 eleven cash in option is removed, It's the only cash in method I always use since service charge only cost 2 pesos or lower. 7 eleven is much more convenient on cash in transactions than other options provided.",1,play store,2020-06-01 00:00:00
2020-06-04 03:38:24,😁😁😁😁,1,play store,2020-06-01 00:00:00
2020-06-04 04:59:40,😷🤒🤒,1,play store,2020-06-01 00:00:00
2020-06-04 07:50:52,"I intent to give u 5 stars, can you help me to the account of ethereum so I can Transfer the amount from tokenpocket to this app? I paid 20 pesos for the registration of ETH account and yet it failed to receive it from tokenpocket.. Please help me. Thanks.",1,play store,2020-06-01 00:00:00
2020-06-04 09:59:00,I cannot update my email add!! fix this,1,play store,2020-06-01 00:00:00
2020-06-04 10:21:40,Mag nanakaw tong application na to. Tangina nyo pag alam nyong malaking pera laman ng owner ang gagawin nyo I boblock nyo para hindi na makuha yung pera. Mga mag nanakaw kayo!!!!!!!!,1,play store,2020-06-01 00:00:00
2020-06-04 13:58:56,"the app is very hard to use, not user friendly, unlike GCash which is the best mobile wallet app made. I cannot cash in through Dragonpay, mobile verification takes so long ishhh.",1,play store,2020-06-01 00:00:00
2020-06-04 16:11:28,Please fix this issue. I buy load two times first is gigasurf99 and second is alloutsurf30 but instead of gigasurf then alloutsurf the load sent are both gigasurf99. please fix now my balance deducted another 99 instead of 30 only which what should have been the load that I requested.,1,play store,2020-06-01 00:00:00
2020-06-04 17:09:54,Why am i not receiving any sms or email verification code??? I tried a lot of times and still no code ugh!,1,play store,2020-06-01 00:00:00
2020-06-04 18:09:00,I can't get my verification code 😑 i use my mobile number and my email account but still can't get my verification code 😑😑😑,1,play store,2020-06-01 00:00:00
2020-06-04 22:48:45,You can't create an account they will not send you verification code,1,play store,2020-06-01 00:00:00
2020-06-05 03:11:41,"Hindi nila inaaccept lahat ng valid id's ko, postal, umid, pati license ko hindi nila inaaccept",1,play store,2020-06-01 00:00:00
2020-06-05 03:33:40,Tried to verifying it's not letting me,1,play store,2020-06-01 00:00:00
2020-06-05 09:22:08,What happened to my coins.ph. I can't open.,1,play store,2020-06-01 00:00:00
2020-06-05 13:36:12,I change password and number bakitt yong laman ng coins ko nawala pano ko mababalik ang account na yon ?,1,play store,2020-06-01 00:00:00
2020-06-05 16:12:06,"hard to get verify. even if the upload are very clear ,, i reccomended this app to uninstall so much headache due to this app",1,play store,2020-06-01 00:00:00
2020-06-05 16:46:13,"Very frustrating... I've been using this I think more than 5 years already but unfortunately my account was deactivated because I cannot submit documents they asked when they have me kyc'd at the start of 2020. I am level 3 verified but they got me kyc'd again, they asked stocks cert., business permits, and other bs.. They suspected my account to have been used in fraudulent transactions.. I only used this to buy loads and small amounts of crypto currencies.. Very unfortunate experience...",1,play store,2020-06-01 00:00:00
2020-06-05 22:09:05,Problem signing in... I've entered my mobile number or email with password but no verification code receive on either both.,1,play store,2020-06-01 00:00:00
2020-06-05 23:22:53,Its wasting of time .Can you please fix this problem.why i can't recieve a code from this app? I used my email and my phone number. But it was the same problem to my first concern 😠😠😠😠😭😭,1,play store,2020-06-01 00:00:00
2020-06-06 00:13:35,Been trying to get approved..just because billease...has them as their pay option...numerous email..sent I'd numerous times still get sent back need to resubmit ..please any of you out there both these company not worth dealing with use other options.,1,play store,2020-06-01 00:00:00
2020-06-06 00:36:56,How am i gonna use it when you're not sending the code,1,play store,2020-06-01 00:00:00
2020-06-06 08:36:41,why i cant put a referral code on my coins.ph?,1,play store,2020-06-01 00:00:00
2020-06-06 10:20:34,I love this wallet but the coins.ph is dumb ive been waiting for alot of our to get the code i even have 5bars in my signal and still it dosent send pls help me coins.ph,1,play store,2020-06-01 00:00:00
2020-06-06 18:00:10,Should tie up with convenience stores for adding funds.,1,play store,2020-06-01 00:00:00
2020-06-07 04:42:19,"Im not receiving the code to verify my phone number and its really hard to verify address, there's a lot of requirements.. better use GCASH",1,play store,2020-06-01 00:00:00
2020-06-07 04:53:57,Why your registration is so hard many times verified my id card always unverified ...lol this app,1,play store,2020-06-01 00:00:00
2020-06-07 05:27:10,You should add a via Bank cards as cash in method.,1,play store,2020-06-01 00:00:00
2020-06-07 09:34:15,Hopefully next time the student ID will be available because High School students women and men find that they make money and save money,1,play store,2020-06-01 00:00:00
2020-06-07 11:53:35,ilang bese na ako nagtry magverified ng account ko kaso hanggang ngaun wla padin sobrang tagal ng responce nakakaumay ung 1business day umaabot ng ilang weeks hanggang sa wla na tlga,1,play store,2020-06-01 00:00:00
2020-06-07 14:44:15,I can't verify my account here. Been trying for 3 months still doesn't work.,1,play store,2020-06-01 00:00:00
2020-06-07 18:35:35,Di na nakakaload ng PLDT number. Nakakadismaya.,1,play store,2020-06-01 00:00:00
2020-06-07 21:10:45,Can't verify my account cuz I don't receive any verification code,1,play store,2020-06-01 00:00:00
2020-06-08 03:37:27,I cannot verified my email for about a week now. It says that the code will be sent to my email but still havent received any. How long should I wait?,1,play store,2020-06-01 00:00:00
2020-06-08 04:10:01,Lost a few bucks here. Not as secure as i thought,1,play store,2020-06-01 00:00:00
2020-06-08 04:35:01,Grabe magsusubmit ka ng ID na sobrang linaw tapos signature talaga ang malabo sa ID di na tatanggapin saklap pa dun isang araw mo hihintayin tapos hindi naman pala nila aaprubahan.. napakasobrang daming verification tapos ID mo di tatanggapin mukha ba akong manloloko? ayusim nyo naman di ako makapagcash out sa app nyong daming etche bureche,1,play store,2020-06-01 00:00:00
2020-06-08 06:15:55,Disappointed app,1,play store,2020-06-01 00:00:00
2020-06-08 07:22:26,"If I can give a zero star, I definitely would. How can I create an account if your mobile and email verification is not working. I tried to click resend verification code a couple of times but I never received your phone and email verification. I wanted to use this because of the hassle that I've been with GCASH but I didn't expect that it's more hassle to set up an account with coins.ph. If it's already a hassle just to set up an account how much more if I started to use it.",1,play store,2020-06-01 00:00:00
2020-06-08 11:45:24,This app has the most irresponsive service Like all the reqest to get codes to creat an account never came until i throttled TRASH THIS APP NEVER USE IS IT'S THE WORST SERVICE YOU'LL HAVE Gcash is more reliable this times of need,1,play store,2020-06-01 00:00:00
2020-06-08 14:06:40,I cannot download this app,1,play store,2020-06-01 00:00:00
2020-06-08 21:39:49,It Doesn't allow me to Convert Prepaid Load to eCash!!!,1,play store,2020-06-01 00:00:00
2020-06-08 23:50:01,I was trying to verify my email but a code was not being sent to my email. Taking picture w/ id to verify your identity was also difficult. This is the worst. Please fix this.,1,play store,2020-06-01 00:00:00
2020-06-09 01:05:40,TANG INANG COINS.PH TO BAWAL PHIL HEALTH ID AMPOTA BOBO NG GUMAWA NETO😂 TATANGA NYO NAMAN VALID ID NAMAN ANG PHIL HEALTH! MGA UTAK BIYA HIHINA NG KOKOTE NYO!😡,1,play store,2020-06-01 00:00:00
2020-06-09 01:40:13,"Why i can't create an account?i used my mobile #, email, but i didn't receive any code to register",1,play store,2020-06-01 00:00:00
2020-06-09 02:08:54,I can't make an account.,1,play store,2020-06-01 00:00:00
2020-06-09 05:00:45,"Apaka arte, mag cash in ka kelan pa maverify bwisit",1,play store,2020-06-01 00:00:00
2020-06-09 05:17:35,Why so hard to sign?i always tap it 100x but it cant accept my account.why?,1,play store,2020-06-01 00:00:00
2020-06-09 08:40:31,the mobile verification takes ages and ages and ages and up until now i haven't received any code yet very frustrating.,1,play store,2020-06-01 00:00:00
2020-06-09 11:23:17,"I can't create my account. I tried using phone number or email it is not sending a code. Re-install it, same thing happened.",1,play store,2020-06-01 00:00:00
2020-06-09 11:43:21,Di makapag sign up😒,1,play store,2020-06-01 00:00:00
2020-06-09 12:37:41,Its good,1,play store,2020-06-01 00:00:00
2020-06-09 14:14:44,2x na nangyari sakin ang unathorized transaction bulok ang sistema nyo!! sa inyo na yang pera ko abuloy ko na yan sa inyo not once but twice pota kayo,1,play store,2020-06-01 00:00:00
2020-06-09 16:01:44,"This app is a scam, i bought 300php for garena shell, yet my my puchase did not come. Hopefully you can fix it as soon as possible. Please help me to refund it. Thanks 😩",1,play store,2020-06-01 00:00:00
2020-06-09 17:04:33,The phone or email verification are not working when you create an account.,1,play store,2020-06-01 00:00:00
2020-06-10 00:43:56,How can I change my name in my account 😑,1,play store,2020-06-01 00:00:00
2020-06-10 01:46:00,I cant sign up for an account :( I keep on trying but I didnt receive any verification code. Huhuhu,1,play store,2020-06-01 00:00:00
2020-06-10 01:56:35,They refused to cancel my account after the SMS skimming incident.,1,play store,2020-06-01 00:00:00
2020-06-10 03:43:06,"Sometimes my wallet appeared zero balance and im confused and allarmed but when i reset my phone it appeared my balanced wallet,",1,play store,2020-06-01 00:00:00
2020-06-10 04:46:45,my city is not on the list ...i can't complete the sign up,1,play store,2020-06-01 00:00:00
2020-06-10 11:35:33,Antagal ng email verification. zero star dapat ito eh.,1,play store,2020-06-01 00:00:00
2020-06-10 20:53:10,"This is totally!! SCAM!! I've been using this app for my business. Then eventually nung nag ccash in and cash out na q for my business, bigla nilang ihohold ang account mo and ofcourse yung matitirang money mo sa account. Pede ka parin mag cash in but di mo na sya pedeng ICASH OUT!! and they really hold it! Tatawagan ka para maayos kuno. Mag aantay ka ng pagkatagal tagal at the end hold parin account mo! At para makuha to napakaraming rekisitos pa ang dapat mong gawin! Sobrang hussle neto guys",1,play store,2020-06-01 00:00:00
2020-06-11 02:15:03,"Palging maintenace ang mga services nila.

1. Buying load. Sometimes okay pero most of the time sakit sa ulo. palaging failed kasi daw ganito kasi daw ganyan. worse ever. 5-10 times kapa mag retry para lang mag success yung load ko.

2. Palging maintenance ang services nila na walang advance notification para man lang ma aware ang user nila. Galing nyo!

3. Sa website status nila okay ang service ang funtional pero pag dating sa app maraming error at pop ups na kasi daw ganito, kasi daw ganyan kaya di daw agad ang serbisyo nila.. wowww! 

mag gcash nalang kayo maganda pa.",1,app store,2020-06-01 00:00:00
2020-06-11 04:10:35,Your apps always not working 😑,1,play store,2020-06-01 00:00:00
2020-06-11 05:36:37,Why dont you have voter's ID in your list of ID's?,1,play store,2020-06-01 00:00:00
2020-06-11 06:55:20,I tried to register couple times 🤦🤦 i cant recieve verification email or phone number.,1,play store,2020-06-01 00:00:00
2020-06-11 08:44:10,"This is a very stressfull app. Everytime i try to log in, it keeps saying that my password does not match with my email add. 👎👎👎",1,play store,2020-06-01 00:00:00
2020-06-11 10:01:11,Unable to receive verification code through email and sms,1,play store,2020-06-01 00:00:00
2020-06-11 10:23:27,"If i could give 0, i would. Their customer service is worse. I have been talking to different staff just for my ID verification. I have provided a lot of information through email and still my ID verification is on under review for weeks now where it is said that it will only take a day for the process. This app sucks.",1,play store,2020-06-01 00:00:00
2020-06-11 11:57:38,Tried to verify my email many times but I didn't receive any. I uninstalled and installed it again but still I cannot proceed the verification of my account!,1,play store,2020-06-01 00:00:00
2020-06-11 15:26:58,Poor app,1,play store,2020-06-01 00:00:00
2020-06-11 15:36:43,"I submit unified ID # , then u want me to submit my sss number? r u guys crazy? sss is included in unified? answer me to this reviews not on ur team, to inform and to read your coinstormer. how can we trust you guys?",1,play store,2020-06-01 00:00:00
2020-06-11 18:11:11,I will edit my comment but not my ratings..After 10days of waiting.. Even I've email and message again help@coinsph even in the app no one is responding..But the coinsph official page is active and the developer..What kind of support when they're not even take a single time to respond on me..They have time to disable my account but no time to response. Been user since 2017 now I'm disappointed.. Maybe its true coins is not safe to leave funds there because one day they might disable ur account,1,play store,2020-06-01 00:00:00
2020-06-12 02:55:18,"THIS APP IS SO INCONVENIENT,, IT REQUIRES A LOT OF VERIFICATION THAT TAKE DAYS TO GET VERIFIED. HELLO WHY DO YOU NEED SO MUCH OF THIS WHEN ALL THE MONEY TO BE INCASHED IS OURS ALONE. I WAS ABOUT TO USE THIS APP TO PAY MY BILLS BUT WAITING AND PROVIDING ALOT OF VERIFICATION MAKE IT EVEN MORE HASSLE THAN GOING TO THE BRANCH OFFICE. THEIR VERIFICATION PROCESS TAKES 2 DAYS WHILE GOING TO THE OFFICE TAKES A HALF DAY AND IT HAS A VERY LIMITED ACCESS TO BANKS AND CASH IN LIMIT. SUCH A WASTE APP",1,play store,2020-06-01 00:00:00
2020-06-12 08:36:46,I can't login!,1,play store,2020-06-01 00:00:00
2020-06-12 09:53:24,Im very disappointing this wallet i send many times my documents but always rejected. Last time i send our bill payment on my elctricty bill. But our bill is under my wife name and i supported our marriage contract but still rejected. Very disappointing i spend lot of time for nothing.,1,play store,2020-06-01 00:00:00
2020-06-12 09:59:49,Is this under maintenance? Bat di po ako mka log in? Please fix this apps.,1,play store,2020-06-01 00:00:00
2020-06-12 10:07:42,"Too much bug it keeps on loading on every page, high fees/spread, easy to purchase but hard to convert cryptos back to fiat, not recommended at all",1,play store,2020-06-01 00:00:00
2020-06-12 10:28:55,Its been too slow in signing in,1,play store,2020-06-01 00:00:00
2020-06-12 13:17:26,I haven't receive Yet my tansfer account from coins.ph to pay maya.. Until now.. Please help me to get my money (4000php) back to my coins wallet or continue send it to my pay maya. Im hoping for your quick response.. 4000 is not an easy money for me to gone.. Thank you and godbless,1,play store,2020-06-01 00:00:00
2020-06-12 19:30:07,Antagal ng email sa join waitlist sa coins pro,1,play store,2020-06-01 00:00:00
2020-06-12 20:37:38,😈,1,play store,2020-06-01 00:00:00
2020-06-13 00:37:17,worst and most useless app ever!,1,play store,2020-06-01 00:00:00
2020-06-13 05:08:21,I cannot make an account to this app...is useless for me,1,play store,2020-06-01 00:00:00
2020-06-13 06:09:55,tagal naman ng patalastas nyu... :(,1,play store,2020-06-01 00:00:00
2020-06-13 07:13:07,Please help me. Sign up code always invalid even my referral code is valid. What's wrong? It this updated. The old version was a 'Referral code. I cant create an account. I want referral rewards to be worth it/fair,1,play store,2020-06-01 00:00:00
2020-06-13 07:59:30,Ang hirap mag level 3 tsskkkkk,1,play store,2020-06-01 00:00:00
2020-06-13 10:13:28,di ma access accnt. wla nman nyayari di makatulong customer service. pano maveverify kung puro deny. wlang kwenta,1,app store,2020-06-01 00:00:00
2020-06-13 13:05:34,Dont ever download this app this people are scammers high fee than the other wallet I transfered my btc balance 5000php to coinbase they charge me 200 pesos and I converted my money to btc they charge me 500 pesos. I will never ever recommend this to anyone. I did talk to their customer service about it and they replied they didnt refund anything. Dont ever download this app nor use this for your transaction. I highly recommend coinbase 4php only when I try to transfer my btc to other wallet.,1,play store,2020-06-01 00:00:00
2020-06-13 17:14:09,2fa is used so that u cn notify us before making a transaction right? Then why the transaction that was not made by me proceeded even without an email nor a text? O come on.. its not even on your help center service but stated at the history.. useless.,1,play store,2020-06-01 00:00:00
2020-06-14 03:43:57,No student ID selection.,1,play store,2020-06-01 00:00:00
2020-06-14 07:14:48,"I'm giving a 1 star, because I can't create an account the SMS verification code is not sending to me and I just keep requesting new verification code but still they did not send it to me. :(",1,play store,2020-06-01 00:00:00
2020-06-14 07:55:20,ANG PANGIT NG SERVICE AYAW TANGGAPIN YUNG DRIVERS LICENSE KO KASI BLURY DAW SIGNATURE WHICH IS NORMAL NA NUNG NA PRINT YUNG I.D KO GRABE NAKAKABADTRIP YUNG PAGKA CHOOSY NYO AMPANGIT NAMAN NG APP NYP PALAGING DOWN. IMBES NA FIRST TIME KO MAG COINS BABALIK NALANG AKO SA GCASH NAKAKA HB KASI 5 BESES KO NA PINICTURAN I.D KO AYAW PADIN TANGGAPIN.,1,play store,2020-06-01 00:00:00
2020-06-14 13:48:33,"Very difficult to verified because did not accept valid Id's like Voters Id, Tin ID, and Philheatlh....Please accept Voters Id..",1,play store,2020-06-01 00:00:00
2020-06-15 00:31:44,"I installed the app, wanting to create an account but IT WON'T SEND A VERIFICATION CODE on my Phone, even through email, or even FACEBOOK login. All errors what the hell, do you want us to use the app or not????",1,play store,2020-06-01 00:00:00
2020-06-15 02:04:23,am so disappointed this time the security features of the app does not work some had access. my account and transfer my money to someone else you need to do somethinf about this,1,play store,2020-06-01 00:00:00
2020-06-15 03:56:39,Why always I can't open my account what's wrong,1,play store,2020-06-01 00:00:00
2020-06-15 05:24:38,I can't receiv my funds!!!???,1,play store,2020-06-01 00:00:00
2020-06-15 05:41:54,uninstall.. nd naman ngsesend ng code.. zero star dapat sakin,1,play store,2020-06-01 00:00:00
2020-06-15 07:19:23,"Do not install this app. Signing up using your mobile number, facebook account and email does not work. Waste of time.",1,app store,2020-06-01 00:00:00
2020-06-15 09:54:25,I hate this app!!! Try to verify it always say the picture is blurry i try it many times!!!!!!!!,1,play store,2020-06-01 00:00:00
2020-06-15 11:06:41,I have money on btc almost 1k then when i convert into php no money has add,1,play store,2020-06-01 00:00:00
2020-06-15 14:37:06,Why I cannot download the apps.,1,play store,2020-06-01 00:00:00
2020-06-15 14:46:43,1. PRC ID is on the list of allowed IDs but ended up rejected because the ID needs to have my address. Why put it on the list though? 2. NBI clearance is also on the list but requires it to have a visible signature. There's the problem. NBI does not print clearances with clear signatures on them. We all know that. Would've been better if verification is easier like with GCash and Paymaya. But nah.,1,play store,2020-06-01 00:00:00
2020-06-15 17:28:29,Ang tagal mag send ng verification code both email and text,1,play store,2020-06-01 00:00:00
2020-06-16 02:13:56,I'm not happy with this app .. compared to gcash ... The verification of my identification were not successful up to this writing.. I think I'm just going to uninstall this app .. so so so difficult it's a week and still not successful..,1,play store,2020-06-01 00:00:00
2020-06-16 04:04:27,"Scammer!!! Please give my 60,520php back!!! Its for my apartment!!! Please give it back!!! I beg you!!!",1,play store,2020-06-01 00:00:00
2020-06-16 04:45:54,Doesn't work,1,play store,2020-06-01 00:00:00
2020-06-16 06:38:47,The codes for shopee is always wrong. Badtrip 😡😠,1,play store,2020-06-01 00:00:00
2020-06-16 08:12:17,Loading simulator. This app is slow as f***,1,play store,2020-06-01 00:00:00
2020-06-16 09:30:16,Bulok mo,1,play store,2020-06-01 00:00:00
2020-06-16 13:54:19,Limited option to cash in and it's so much a hassle.,1,play store,2020-06-01 00:00:00
2020-06-16 14:11:54,My account cannot repassword,1,play store,2020-06-01 00:00:00
2020-06-16 14:17:50,Received email that they are processing cash-out from BPI when I did not initiate any transfer and my last transaction is more than 3 months ago. Also received erratum email regarding this saying it was sent by mistake. Very poor handling of accounts/profiles of people who use the app.,1,play store,2020-06-01 00:00:00
2020-06-16 19:48:44,"ginawa ko na lahat para marecover account kc nka two facfor aunthenticator s nwla kung phone... ginwa ko n lht ng ways to recover my acc ,pero wla pdin safe nga kya maganda pero pano nmn kung ako tlga yung may ari..tssk",1,play store,2020-06-01 00:00:00
2020-06-17 01:29:11,I was trying to upgrade level 3 and won't accept accept scanned original documents it says invalid. I am so disappointed it's 2 weeks been trying to upload the needed requirements,1,play store,2020-06-01 00:00:00
2020-06-17 02:31:31,failed to upload selfie. Failed to upload valid ID front and back image,1,play store,2020-06-01 00:00:00
